5981,2010-09-20,Jeopardy!,"THE LOYOLA OPPOSITION","$600","When Clement XIV abolished the Jesuits in 1773, they thrived in Russia with help from this empress","Catherine the Great"
5981,2010-09-20,Jeopardy!,"YOUR HONOR, I OBJECT!","$600","Counsel is putting words in the witness' mouth with this type of question; the word also means ""in first place""","a leading question"
5981,2010-09-20,Jeopardy!,"GOOD CAUSES","$2,000","A ""Mission"" to help the homeless is named for this Lower Manhattan street known as a skid row since the 1800s","Bowery"
5981,2010-09-20,Jeopardy!,"BLARNEY","$600","This type of sprite will lead you to the gold","a leprechaun"
5981,2010-09-20,Jeopardy!,"LESSER-KNOWN AMERICANS","$800","Named for his cousin, James Buchanan Eads built the first bridge across this river at St. Louis","the Mississippi"
5981,2010-09-20,Jeopardy!,"COUNTRY MUSIC","$800","This sound, like that made by plucking a guitar, is the title of a 2009 album by George Strait","twang"
5981,2010-09-20,Jeopardy!,"THE LOYOLA OPPOSITION","$800","In 1542 missionaries sent by Ignatius to Ireland were hampered by this king","Henry VIII"
5981,2010-09-20,Jeopardy!,"YOUR HONOR, I OBJECT!","$800","Counsel is being argumentative, also known as doing this to the witness, as seen here","badgering"
5981,2010-09-20,Jeopardy!,"GOOD CAUSES","$800","The LFA is a leading group battling this disease named for lesions that resemble a wolf's bite","lupus"
5981,2010-09-20,Jeopardy!,"BLARNEY","$800","Tiny pieces, or the New Jersey band that sang ""Only a Memory""","smithereens"
5981,2010-09-20,Jeopardy!,"LESSER-KNOWN AMERICANS","$1000","Doris Eaton Travis, who passed away in 2010 at age 106, was the last surviving showgirl from these follies","Ziegfeld"
5981,2010-09-20,Jeopardy!,"COUNTRY MUSIC","$1000","This frontman of Hootie & the Blowfish went country with his solo album ""Learn to Live""","(Darius) Rucker"
5981,2010-09-20,Jeopardy!,"THE LOYOLA OPPOSITION","$1000","While in Paris, Ignatius was accused & brought before Ori, this type of truth-seeking 10-letter holy man","an inquisitor"
5981,2010-09-20,Jeopardy!,"YOUR HONOR, I OBJECT!","$1000","We've heard the question already; I'm making this objection that could be called ""triple a""","asked and answered"
5981,2010-09-20,Jeopardy!,"GOOD CAUSES","$1000","The Andre Agassi foundation for education runs Agassi Prep in this city","Las Vegas"
5981,2010-09-20,Jeopardy!,"BLARNEY","$1000","This word for a type of liquor applies to a 1794 American rebellion","whiskey"
5981,2010-09-20,Double Jeopardy!,"MOVIE CITIES","$400","Of course there's a car chase on the freeway in 1985's ""To Live and Die in __.__.""","L.A."
5981,2010-09-20,Double Jeopardy!,"WOMEN: WRITE ON!","$400","Sadly, she died in Boston in 1888, just 2 days after her transcendentalist father Bronson","Louisa May Alcott"
5981,2010-09-20,Double Jeopardy!,"GOAT-POURRI","$400","Goat Island splits Niagara Falls into the American Falls & this waterfall on the Canadian side","Horseshoe Falls"
5981,2010-09-20,Double Jeopardy!,"EPONYMS","$400","Although sources disagree over the origin of this ""do-over"" golf shot, many accept that it was named for a bad golfer","a Mulligan"
5981,2010-09-20,Double Jeopardy!,"""A"" SCIENCE CATEGORY","$800","It's what the ""A"" stands for in AIDS","acquired"
5981,2010-09-20,Double Jeopardy!,"MOVIE CITIES","$800","2010 brought Travolta as a spy in ""From ____ with Love""","Paris"
5981,2010-09-20,Double Jeopardy!,"LAST NAME'S THE SAME","$800","Entertainment mogul Barry & funny lady Phyllis","Diller"
5981,2010-09-20,Double Jeopardy!,"WOMEN: WRITE ON!","$800","In 2009 she published her 76th bestseller, ""Matters of the Heart"", & was inducted into the Calif. Hall of Fame","Danielle Steel"
5981,2010-09-20,Double Jeopardy!,"GOAT-POURRI","$800","In 1846 Neptune was discovered in this constellation, the 10th sign of the zodiac","Capricorn"
5981,2010-09-20,Double Jeopardy!,"EPONYMS","$800","This country is named after ""the George Washington of South America"" (the actual George only got cities & a state)","Bolivia"
5981,2010-09-20,Double Jeopardy!,"""A"" SCIENCE CATEGORY","$1200","(Kelly of the Clue Crew stands behind a table)   The experiment showing that two objects weighing the same displace different amounts of water because they have different densities was developed by this mathematician","Archimedes"
5981,2010-09-20,Double Jeopardy!,"MOVIE CITIES","$1200","2010, starring Kristen Bell: ""When in ____""","Rome"
5981,2010-09-20,Double Jeopardy!,"LAST NAME'S THE SAME","$1200","Late radio commentator Paul & James I's physician William","Harvey"
5981,2010-09-20,Double Jeopardy!,"WOMEN: WRITE ON!","$1200","Esther Greenwood is an aspiring poet in this poet's novel ""The Bell Jar""","Sylvia Plath"
5981,2010-09-20,Double Jeopardy!,"GOAT-POURRI","$1200","In ""The Hunchback of Notre Dame"", Pierre Gringoire rescues this gypsy girl's goat from a mob","Esmeralda"
5981,2010-09-20,Double Jeopardy!,"EPONYMS","$4,000","Meaning elegant or fancy, it's from the name of a hotel chain founded by a Swiss businessman","ritzy"
5981,2010-09-20,Double Jeopardy!,"""A"" SCIENCE CATEGORY","$1600","In the 1920s Edwin Hubble determined that this galaxy was in fact a separate galaxy from the Milky Way","Andromeda"
5981,2010-09-20,Double Jeopardy!,"MOVIE CITIES","$1600","2008's ""The Mysteries of ____"" was based on a novel","Pittsburgh"
5981,2010-09-20,Double Jeopardy!,"LAST NAME'S THE SAME","$1600","""Tennessee Tailor"" Andrew & poet/NAACP leader James Weldon","Johnson"
5981,2010-09-20,Double Jeopardy!,"WOMEN: WRITE ON!","$1600","""Shiksa Goddess: (or, How I Spent My Forties)"" is a collection of essays by this ""Heidi Chronicles"" playwright","(Wendy) Wasserstein"
5981,2010-09-20,Double Jeopardy!,"GOAT-POURRI","$1600","The backward-curving horns of the Siberian species of this 4-letter goat may be nearly 5 feet long","ibex"
5981,2010-09-20,Double Jeopardy!,"EPONYMS","$1600","This submachine gun was named for an Israeli army officer whose design won a competition in the 1950s","Uzi"
5981,2010-09-20,Double Jeopardy!,"""A"" SCIENCE CATEGORY","$12,000","These are just small masses of lymphoid tissue in the nasopharynx","adenoids"
5981,2010-09-20,Double Jeopardy!,"MOVIE CITIES","$2000","The 1980 Oscar winner for Foreign Language Film was ""____ does Not Believe in Tears""","Moscow"
5981,2010-09-20,Double Jeopardy!,"LAST NAME'S THE SAME","$2000","17th century philosopher Sir Francis & 20th century painter Francis","Bacon"
5981,2010-09-20,Double Jeopardy!,"WOMEN: WRITE ON!","$2000","""Seducing the Demon: Writing for my Life"" is a 2006 memoir by this ""Fear of Flying"" author","Erica Jong"
5981,2010-09-20,Double Jeopardy!,"GOAT-POURRI","$2000","Crippled beggar Sammy Smalls, who traveled in a goat cart, inspired a title character of this opera set on Catfish Row","Porgy and Bess"
5981,2010-09-20,Double Jeopardy!,"EPONYMS","$2000","Named for a French courtesan, Pommes Anna is a dish of layered these, not apples","potatoes"
5981,2010-09-20,Final Jeopardy!,"THE WESTERN HEMISPHERE","None","Made up of 1 large & many smaller islands, it's the most populous of Britain's remaining overseas territories","Bermuda"
3112,1998-02-24,Jeopardy!,"THE DIRECTOR SPEAKS","$100","""I never believed in anything before I believed in movies"", said this ""E.T."" director","Spielberg"
3112,1998-02-24,Jeopardy!,"PLACES","$100","A small & informal restaurant, or one who eats there","diner"
3112,1998-02-24,Jeopardy!,"""LIGHT""s","$100","Famous ones include Ray ""Boom Boom"" Mancini & Roberto ""Hands of Stone"" Duran","lightweights"
3112,1998-02-24,Jeopardy!,"CAMERA","$100","The names of TV cameras & videocassette recorders are combined in this device","a camcorder"
3112,1998-02-24,Jeopardy!,"ACTION!","$100","This hero made his comic book debut in & on the cover of Action Comics No. 1","Superman"
3112,1998-02-24,Jeopardy!,"WHERE'S MY COFFEE?","$100","Once Yemen's chief coffee port, its name now refers to a flavor of chocolate & coffee","Mocha"
3112,1998-02-24,Jeopardy!,"THE DIRECTOR SPEAKS","$200","""Everybody denies I am a genius--but nobody ever called me one!"" noted this man who raised ""Kane""","Orson Welles"
3112,1998-02-24,Jeopardy!,"PLACES","$200","A building for religious veneration, or the L.A. auditorium that hosted 1997's Academy Awards","shrine"
3112,1998-02-24,Jeopardy!,"""LIGHT""s","$200","To do this to someone's plight, you could trivialize it, or just take the P away","make light of it"
3112,1998-02-24,Jeopardy!,"CAMERA","$200","Aptly, underwater photography may require these widest wide-angle lenses","fisheye lenses"
3112,1998-02-24,Jeopardy!,"ACTION!","$200","In a 1965 speech this president put out a call for ""affirmative action"" in hiring by federal contractors","Johnson"
3112,1998-02-24,Jeopardy!,"WHERE'S MY COFFEE?","$200","The flavorful coffee beans from this country are grown at high altitudes near Nairobi","Kenya"
3112,1998-02-24,Jeopardy!,"THE DIRECTOR SPEAKS","$300","When an actress in his ""Lifeboat"" asked him what her best side was, he said, ""My dear, you're sitting on it""","Hitchcock"
3112,1998-02-24,Jeopardy!,"PLACES","$300","Libraries & the Christian Science Church maintain these areas; the British Museum built a big one in 1857","reading rooms"
3112,1998-02-24,Jeopardy!,"""LIGHT""s","$300","Ben Franklin invented this device & would have been shocked if it hadn't worked","the lightning rod"
3112,1998-02-24,Jeopardy!,"CAMERA","$300","In 1986 Kodak left the instant camera business after a judge found it had violated this company's patents","Polaroid"
3112,1998-02-24,Jeopardy!,"ACTION!","$300","You may not give a fig, but according to Newton, there's one of these for every action","an equal & opposite reaction"
3112,1998-02-24,Jeopardy!,"WHERE'S MY COFFEE?","$300","Java is a synonym for coffee; a high-grade bean also comes from this next most populous Indonesian island","Sumatra"
3112,1998-02-24,Jeopardy!,"THE DIRECTOR SPEAKS","$400","""Manhattan""ite who said, ""Life is divided into the horrible and the miserable""--sounds ""Bananas"" to us","Woody Allen"
3112,1998-02-24,Jeopardy!,"PLACES","$400","A place where a river is shallow enough to cross on foot, alone or with an ""escort""","a ford"
3112,1998-02-24,Jeopardy!,"""LIGHT""s","$400","A joking question asked about many groups is ""How many does it take to"" do this","screw in a light bulb"
3112,1998-02-24,Jeopardy!,"ACTION!","$400","The action of a boy can ring a girl's bell, & the action of these can ring a buoy's bell","a wave"
3112,1998-02-24,Jeopardy!,"WHERE'S MY COFFEE?","$400","Mexico's best coffee comes from Chiapas, a state that borders this noted coffee-growing nation","Guatemala"
3112,1998-02-24,Jeopardy!,"THE DIRECTOR SPEAKS","$500","""The best director is the one you don't see"", observed this director of ""Some Like It Hot""","Billy Wilder"
3112,1998-02-24,Jeopardy!,"PLACES","$500","This term for a house's entrance hall also refers to the space between cars on a train","the vestibule"
3112,1998-02-24,Jeopardy!,"""LIGHT""s","$500","""I'm gonna let it shine, let it shine, let it shine, let it shine""","this little light of mine"
3112,1998-02-24,Jeopardy!,"ACTION!","$500","Dutch-American artist about whose work the term ""action painting"" was coined","Willem de Kooning"
3112,1998-02-24,Double Jeopardy!,"SHAKESPEAREAN OPERAS & BALLETS","$200","It's the play that inspired Reynaldo Hahn's opera ""Le Marchand de Venise""","The Merchant of Venice"
3112,1998-02-24,Double Jeopardy!,"BACKWARDS","$200","In T minus 5 seconds, you'll say this word for the inverted series used before a rocket launch","a countdown"
3112,1998-02-24,Double Jeopardy!,"CARTOONS","$200","Mel Blanc said he created this character's voice by combining Brooklyn & Bronx accents","Bugs Bunny"
3112,1998-02-24,Double Jeopardy!,"19th CENTURY AMERICA","$200","The discovery of this in 1896 turned Seward's Folly into Seward's Good Fortune","gold"
3112,1998-02-24,Double Jeopardy!,"MEN OF THE WORLD","$200","Armando Munoz Garcia sculpted a 55' statue of a nude woman & lived in it in this Mexican city near San Diego","Tijuana"
3112,1998-02-24,Double Jeopardy!,"WORD ORIGINS","$200","This state's name is from the Sioux for ""sky-tinted waters""; maybe they meant the 10,000 lakes","Minnesota"
3112,1998-02-24,Double Jeopardy!,"SHAKESPEAREAN OPERAS & BALLETS","$400","The Bolshoi presented this ballet at the Met in 1959, with Yuri Zhdanov & Galina Ulanova as the title lovers","Romeo & Juliet"
3112,1998-02-24,Double Jeopardy!,"BACKWARDS","$400","In psychology it's the process of reverting to an earlier, childlike form of behavior","regression"
3112,1998-02-24,Double Jeopardy!,"CARTOONS","$400","I say there, son, this Warner Bros. cartoon rooster is sometimes pursued by a chicken hawk","Foghorn Leghorn"
3112,1998-02-24,Double Jeopardy!,"19th CENTURY AMERICA","$400","The 1866 Civil Rights Act was passed over this president's veto","Johnson"
3112,1998-02-24,Double Jeopardy!,"MEN OF THE WORLD","$400","The U.S. statesman seen <a href=""http://www.j-archive.com/media/1998-02-24_DJ_22.jpg"" target=""_blank"">here</a> was born in 1923 in this country:","Germany"
3112,1998-02-24,Double Jeopardy!,"WORD ORIGINS","$400","The Old Norse word ""vindauga"" gave us this pane-ful word for an opening in a wall","window"
3112,1998-02-24,Double Jeopardy!,"SHAKESPEAREAN OPERAS & BALLETS","$600","You'll need some long-winded singers to star in ""Stormen"", a Swedish opera based on this play","The Tempest"
3112,1998-02-24,Double Jeopardy!,"BACKWARDS","$600","Field Marshal Barclay used this maneuver associated with defeat to lure Napoleon deep into Russia","a retreat"
3112,1998-02-24,Double Jeopardy!,"CARTOONS","$600","On screen, he's a ""tubby little cubby all stuffed with fluff""","Winnie the Pooh"
3112,1998-02-24,Double Jeopardy!,"19th CENTURY AMERICA","$600","Kansas homesteader Bewster Higley's poem ""The Western Home"" was retitled this when set to music","""Home On The Range"""
3112,1998-02-24,Double Jeopardy!,"MEN OF THE WORLD","$600","This media mogul from Melbourne has been called a real-life Citizen Kane","Rupert Murdoch"
3112,1998-02-24,Double Jeopardy!,"WORD ORIGINS","$600","Derived from the Latin for ""salted vegetables"", this cold dish might be enhanced with a little oil & vinegar","salad"
3112,1998-02-24,Double Jeopardy!,"SHAKESPEAREAN OPERAS & BALLETS","$800","Verdi wrote an aria called ""La Luce Langue""--The Light Fails--for this bloothirsty villainess","Lady Macbeth"
3112,1998-02-24,Double Jeopardy!,"BACKWARDS","$800","In competitive rowing, this is the only person in the boat whose back is not to the finish line","the coxswain"
3112,1998-02-24,Double Jeopardy!,"CARTOONS","$800","Ted Cassidy, who played Thing on ""The Addams Family"", was also the voice of The Thing of this superhero group","The Fantastic 4"
3112,1998-02-24,Double Jeopardy!,"19th CENTURY AMERICA","$800","To avoid Boss Tweed's graft, Alfred Beach secretly built one of these under Broadway in 1869-70","a subway"
3112,1998-02-24,Double Jeopardy!,"WORD ORIGINS","$800","This number can be traced back to the Sankrit ""Shunya"", or empty","zero"
3112,1998-02-24,Double Jeopardy!,"SHAKESPEAREAN OPERAS & BALLETS","$500","Title character played by former Alvin Ailey dancer Desmond Richardson in a 1997 ballet","Othello"
3112,1998-02-24,Double Jeopardy!,"BACKWARDS","$1000","Called ""Bojangles"", he was renowned for tap dancing on stairs & running backwards at high speed","(Bill) Robinson"
3112,1998-02-24,Double Jeopardy!,"CARTOONS","$1000","Sylvester believes Hippety Hopper, a baby one of these, to be a gigantic mouse","a kangaroo"
3112,1998-02-24,Double Jeopardy!,"WORD ORIGINS","$1,000","The -sex suffix on British placenames refers to this Germanic people","the Saxons"
3112,1998-02-24,Final Jeopardy!,"FAMOUS VOYAGES","None","Capt. Robert Fitzroy of this ship argued that its scientific discoveries supported the Bible","the Beagle"
5431,2008-03-31,Jeopardy!,"GENERAL INFORMATION","$200","This title folk story guy steals a golden egg-laying hen, bags of gold & a golden harp; the ""giant-cide"" comes later","Jack"
5431,2008-03-31,Jeopardy!,"THE MOVIES","$200","Jack Palance's character is described as ""a saddlebag with eyes"" in this 1991 comedy","City Slickers"
5431,2008-03-31,Jeopardy!,"WEAPONRY","$200","Standard-issue weapons for stormtroopers in ""Star Wars"" included energy-bolt-firing pistols called these","blasters"
5431,2008-03-31,Jeopardy!,"MEDICAL TALK","$200","This term refers to the painful inflammation of any of the fibrous structures that connect muscles to bones","tendinitis"
5431,2008-03-31,Jeopardy!,"FICTIONAL CHARACTERS","$200","What a happy ending: this title orphan of a Dickens novel is adopted by Mr. Brownlow","Oliver Twist"
5431,2008-03-31,Jeopardy!,"CROSSWORD CLUES ""F""","$200","Chips' aquatic partner (4)","fish"
5431,2008-03-31,Jeopardy!,"GENERAL INFORMATION","$400","Playing the pass line in craps, it's the winning number on the opening roll other than 7","11"
5431,2008-03-31,Jeopardy!,"THE MOVIES","$400","(<a href=""http://www.j-archive.com/media/2008-03-31_J_02.jpg"" target=""_blank"">Drew Barrymore delivers the clue.</a>)  In my film ""Music and Lyrics"", Hugh Grant plays the ""Jeopardy! Think Music"" written by this creator of ""Jeopardy!""","Merv Griffin"
5431,2008-03-31,Jeopardy!,"WEAPONRY","$400","In the 1960s Nelson Mandela led the military group ""Umkhonto we Sizwe"", or this weapon ""of the Nation""","Spear"
5431,2008-03-31,Jeopardy!,"MEDICAL TALK","$400","To test for visual acuity, the Snellen chart is designed to be read from this many feet away","20"
5431,2008-03-31,Jeopardy!,"FICTIONAL CHARACTERS","$400","This character in ""The Legend of Sleepy Hollow"" is said to be the ghost of a Hessian trooper","the Headless Horseman"
5431,2008-03-31,Jeopardy!,"CROSSWORD CLUES ""F""","$400","Honshu volcano (4)","Fuji"
5431,2008-03-31,Jeopardy!,"GENERAL INFORMATION","$600","Found in Southeast Asia, they're the smallest apes","gibbons"
5431,2008-03-31,Jeopardy!,"THE MOVIES","$1,000","Irene Bedard, the speaking voice of this heroine in an animated Disney film, played her mother in ""The New World""","Pocahontas"
5431,2008-03-31,Jeopardy!,"WEAPONRY","$600","The first 2 weapons Hamlet mentions in his ""To be or not to be"" soliloquy","slings & arrows"
5431,2008-03-31,Jeopardy!,"MEDICAL TALK","$600","(<a href=""http://www.j-archive.com/media/2008-03-31_J_16.wmv"">Jimmy of the Clue Crew tends to a virtual patient at Beth Israel Deaconess Medical Ctr, a Harvard teaching hospital in Boston, MA.</a>)  A dilated pupil indicates that a head injury may have led to an acute subdural this, where blood accumulates within the skull","a hematoma"
5431,2008-03-31,Jeopardy!,"FICTIONAL CHARACTERS","$600","She is the narrator of ""To Kill a Mockingbird""","Scout"
5431,2008-03-31,Jeopardy!,"CROSSWORD CLUES ""F""","$600","Greek-letter group (10)","fraternity"
5431,2008-03-31,Jeopardy!,"GENERAL INFORMATION","$800","Pick up a GT from this car co. for a tidy $169,000, or maybe start out with a Focus for a more reasonable $13,715","Ford"
5431,2008-03-31,Jeopardy!,"THE MOVIES","$800","(<a href=""http://www.j-archive.com/media/2008-03-31_J_04.jpg"" target=""_blank"">Hi, I'm Sean Hayes.</a>)  In the 2003 film ""Pieces of April"", I played an offbeat neighbor of this actress who had yet to meet & marry Tom Cruise","Katie Holmes"
5431,2008-03-31,Jeopardy!,"WEAPONRY","$800","In the missile called a ""SAM"", it's what the ""A"" stands for","air"
5431,2008-03-31,Jeopardy!,"MEDICAL TALK","$800","It begins, ""I swear by Apollo physician and Asclepius...""","the hippocratic oath"
5431,2008-03-31,Jeopardy!,"FICTIONAL CHARACTERS","$800","2 names that follow Gerald, who speaks in weird sounds instead of words in a Dr. Seuss story","McBoing-Boing"
5431,2008-03-31,Jeopardy!,"CROSSWORD CLUES ""F""","$800","A Mrs., in Munich (4)","Frau"
5431,2008-03-31,Jeopardy!,"GENERAL INFORMATION","$1000","The tuliptree, or ""yellow"" this, was planted by Washington at Mt. Vernon, & Daniel Boone used its wood in his canoe","poplar"
5431,2008-03-31,Jeopardy!,"THE MOVIES","$1000","Jane Russell & Marilyn Monroe sang about being ""Two Little Girls from Little Rock"" in this 1953 movie musical","Gentlemen Prefer Blondes"
5431,2008-03-31,Jeopardy!,"WEAPONRY","$1000","The weapons that are ""bursting"" in line 5 of ""The Star-Spangled Banner""","bombs"
5431,2008-03-31,Jeopardy!,"MEDICAL TALK","$1000","Luteinizing hormone is one of the many produced by this cherry-shaped gland","the pituitary"
5431,2008-03-31,Jeopardy!,"FICTIONAL CHARACTERS","$1000","In a story by Rudyard Kipling, this mongoose protects an English family from snakes","Rikki-Tikki-Tavi"
5431,2008-03-31,Jeopardy!,"CROSSWORD CLUES ""F""","$1000","It's spoken in Hameenlinna & Hyvinkaa (7)","Finnish"
5431,2008-03-31,Double Jeopardy!,"GENERAL INFORMATION","$400","This general, first in his class at West Point, ran for president in 2004","Wesley Clark"
5431,2008-03-31,Double Jeopardy!,"TV PRODUCERS","$400","The Fairmont in this city's Nob Hill was the exterior used for Aaron Spelling's ""Hotel"" TV series","San Francisco"
5431,2008-03-31,Double Jeopardy!,"TOUGH BODIES OF WATER","$400","St. George's Channel separates Wales from this country","Ireland"
5431,2008-03-31,Double Jeopardy!,"HELLO, DELI!","$400","I think I'll just have a nosh--a bagel, cream cheese & the Nova Scotia type of this","lox"
5431,2008-03-31,Double Jeopardy!,"ALSO A BOOK IN THE BIBLE","$400","Caesar, Antony, Cicero, et al.","Romans"
5431,2008-03-31,Double Jeopardy!,"IS IT ""TEA"" TIME YET?","$400","I see in my crystal ball that Bill Hewitt wrote a book about how to read these","tea leaves"
5431,2008-03-31,Double Jeopardy!,"GENERAL INFORMATION","$800","This ""old soldier"" was a general at age 38; in 1930 at age 50, he was Chief of Staff of the U.S. Army","MacArthur"
5431,2008-03-31,Double Jeopardy!,"TV PRODUCERS","$800","David Chase created this HBO series & wrote many of its episodes, like ""Mr. Ruggerio's Neighborhood""","The Sopranos"
5431,2008-03-31,Double Jeopardy!,"TOUGH BODIES OF WATER","$800","Bristol Bay is an arm of this sea off Alaska","the Bering"
5431,2008-03-31,Double Jeopardy!,"HELLO, DELI!","$800","I'll have one of these ""city"" omelets stuffed with ham, onions & green peppers","a Denver omelette"
5431,2008-03-31,Double Jeopardy!,"ALSO A BOOK IN THE BIBLE","$800","In a 1971 song he ""was a bullfrog""","Jeremiah"
5431,2008-03-31,Double Jeopardy!,"IS IT ""TEA"" TIME YET?","$800","A tea room in Cambria, California is named for this kind of teapot cover--& it sells them, too","a cozy"
5431,2008-03-31,Double Jeopardy!,"GENERAL INFORMATION","$3,800","More than 540,000 men & women served under this general's command of the U.S. forces in the Persian Gulf War of 1991","(Norman) Schwarzkopf"
5431,2008-03-31,Double Jeopardy!,"TV PRODUCERS","$1200","He moved from ""Melrose Place"" to the east coast for ""Central Park West"" & ""Sex & the City""","Darren Star"
5431,2008-03-31,Double Jeopardy!,"TOUGH BODIES OF WATER","$1200","Rivers that flow into this sea include the Dnieper, Dniester & Danube","the Black Sea"
5431,2008-03-31,Double Jeopardy!,"HELLO, DELI!","$1200","Someone pass me this noodle pudding filled with raisins  & nuts","kugel"
5431,2008-03-31,Double Jeopardy!,"ALSO A BOOK IN THE BIBLE","$1200","Hey, this, don't be ""obscure""","Jude"
5431,2008-03-31,Double Jeopardy!,"IS IT ""TEA"" TIME YET?","$1200","This slang synonym for oil is mentioned in the theme song to ""The Beverly Hillbillies""","Texas tea"
5431,2008-03-31,Double Jeopardy!,"GENERAL INFORMATION","$1600","The only place this general wouldn't ""march"" was to the presidency; he told the GOP ""I will not accept if nominated"" in 1884","Sherman"
5431,2008-03-31,Double Jeopardy!,"TV PRODUCERS","$1600","In 2003 this ""Survivor"" head honcho began conducting a search to give Donald Trump an apprentice","Mark Burnett"
5431,2008-03-31,Double Jeopardy!,"TOUGH BODIES OF WATER","$1600","The Uruguay River forms the border between Uruguay & Argentina & most of the border between Argentina & this country","Brazil"
5431,2008-03-31,Double Jeopardy!,"HELLO, DELI!","$1600","It's a good knight for one of these Jewish turnovers with a meat or potato filling","a knish"
5431,2008-03-31,Double Jeopardy!,"ALSO A BOOK IN THE BIBLE","$1600","This character first hit the radio in 1928 with his partner Andy","Amos"
5431,2008-03-31,Double Jeopardy!,"IS IT ""TEA"" TIME YET?","$1600","When Lady Diana had doubts about marrying Prince Charles, she was told: Too late. ""Your face is on"" these cloth items","tea towels"
5431,2008-03-31,Double Jeopardy!,"GENERAL INFORMATION","$2000","This Army general headed American-led forces during the initial combat phase of the Iraq War as it began in 2003","Tommy Franks"
5431,2008-03-31,Double Jeopardy!,"TV PRODUCERS","$2000","He probably has another 6 or 7 ""Law & Order"" offshoots on his desk just waiting for network slots","Dick Wolf"
5431,2008-03-31,Double Jeopardy!,"TOUGH BODIES OF WATER","$2,000","This Venezuelan lake is the only one of the world's 25 largest lakes whose elevation is sea level","Lake Maracaibo"
5431,2008-03-31,Double Jeopardy!,"HELLO, DELI!","$2000","Something smells fishy--must be this chopped fish patty mixed with crumbs & eggs & served cold in a jellied broth","gefilte fish"
5431,2008-03-31,Double Jeopardy!,"ALSO A BOOK IN THE BIBLE","$2000","Few were ""better than"" this Mr. Cornell who founded the university in 1865","Ezra"
5431,2008-03-31,Double Jeopardy!,"IS IT ""TEA"" TIME YET?","$2000","In 1975 the Perfumer's Workshop introduced a fragrance named for this flower","a tea rose"
5431,2008-03-31,Final Jeopardy!,"BEFORE THEY WERE SENATORS","None","Later a U.S. senator, in 1962 he made a famous 75,000-mile trip","John Glenn"
5630,2009-02-13,Jeopardy!,"AMERICAN HISTORY","$200","Between 1856 & 1860, 2,962 of this faith set out from Iowa & Nebraska to Utah in the Handcart Migration","Mormonism"
